{
  "event_type": "race.completed",
  "event_id": "0f9eb4bd-18f6-497c-b94d-ad449a21b982",
  "session_id": "sim-1-20260519-123000",
  "racer": {
    "first_name": "Alex",
    "last_name": "Racer",
    "full_name": "Alex Racer",
    "email": "alex@example.com",
    "phone": "+17025550123"
  },
  "race_time_seconds": 83.456,
  "formatted_race_time": "01:23.456",
  "simulator_id": "1",
  "completed_at": "2026-05-19T12:30:00.000000",
  "demo_url": "https://partner.example.com/demo"
}
